구분,ISBN13,review_content,rating
인문학,9788992151412.0,"이런 책을 읽고 나면 평이하고 밀도 깊게 글을 쓰는 외국의 한 학자에게 감탄을 할 것이며, 반면 박학하긴 하되 엉클어진 글쓰기를 주로 보여주는 우리네 비평계에 아쉬움을 가질 것이다. '비평 쓰기의 첫걸음'이라 불러도 좋은 이 책은 여러문학 이론들을 쉽고도 깊이 있게 해설하는 미덕을 갖고 있다",5.0
인문학,9788992151412.0,2023년 4월에 원서 4판이 나왔다. 그런데 우리는 아직도 2판을 보고 있다니. 서둘러 최신판을 번역 출간하라!,4.0
인문학,9788992151412.0,"문학을 보는 다양한 관점을 쉽게 설명해주고, 그에 따른 예시까지 보여주는 훌륭한 책. 더불어 참고문헌까지 섭렵한다면 세상을 보는 눈을 한단계 높혀주리라 확신!",5.0
인문학,9788992151412.0,분야를 떠나서 이렇게 훌륭한 입문서는 처음 본다. 입문서라고 하지만 입문자를 고려하지 않는 다른 교과서와는 차원이 다르다.,5.0
인문학,9788992151412.0,비평과 관련된 기본적인 개념들을 세세하게 설명했다. 다만 거기까지라서 아쉬움이 있다. 책의 목적에는 아주 충실하다.,3.0
인문학,9788992151412.0,다양한 비평이론을 쉽게 접하게 해 주는 책! 에 비평이론을 적용하는 예시까지 제공해서 이해가 훨씬 쉽습니다!,5.0
인문학,9788992151412.0,"사실 교재라 구입햇습니다. 젠더비평, 정신분석비평, 퀴어문학비평... 예를 들며 설명은 되어있는 책입니다. 받아보니 일단 그의 두께에 압도 당하고 읽어보고 수업 잘 들어야되겠다 생각드는 책..",4.0
인문학,9788992151412.0,영화 비평을 위해서 구매한 책.조금더 나은 글쓰기를 위하여 추천!,4.0
인문학,9788992151412.0,책의 두께만 보자면 오랜만에 오르고 싶은 어떤 산을 발견한 느낌이라고나 할까. 그 산에 오르면 많은 것을 조망할 수 있을 책.,5.0
인문학,9788992151412.0,비평이론을 공부한다면 기본기 다지는 용으로 소장하면 좋을 책입니다,5.0
인문학,9788992151412.0,비록 두껍지만 아주 쉽게 읽혀지는 비평이론서입니다. 학생 가르칠 때 교재로 쓰고 있습니다. 아주 좋습니다.,4.0
인문학,9788992151412.0,한번에 모든 것을 해결할 수 있다는 것은 얼마나 매력적이며 유혹적인 것인가! 이 책은 단 한권으로 현존하는 거의 모든 비평이론의 기본기를 다져준다. 그것도 친절하게 일반독자의 수준과 시선에서.,5.0
인문학,9788992151412.0,비평관련 최선의 책이라 들었습니다. 내용 참 좋습니다.,5.0
인문학,9788992151412.0,최고다. 사서 읽어보시라.,5.0
인문학,9788992654562.0,"2021 1월 23일부터 시작해 매주 1단원씩 함께 읽고 실천하고 나눔의 시간 가졌습니다. 선생님과 함께 벗들과 더불어 함께한 성찰과 실천을 통한 성장의 시간. 많이 고맙고 도움된 책이었습니다. 자기 사랑 타인 사랑, 자기 돌봄 타인 돌봄. 자기를 사랑하는 사람은 타인을 너머 우주를 사랑하게 됩니다",5.0
인문학,9788992654562.0,"자존감의 대안, 자기연민으로 더 안정적인 자기가치감 키우기, 일년 내내 곁에 두고 보는 책",5.0
인문학,9788992654562.0,"왜 이렇게 괴로울까, 왜 아무것도 달라지지 않지? 라는 고민이 모두 해결되었어요. 공감의 힘을 깨달았습니다",5.0
인문학,9788992654579.0,리뷰없음,0.0
인문학,9788992792530.0,리뷰없음,0.0
인문학,9788992877442.0,중독에 대해 이렇게 솔직대범명석하게 쓸 수 있다니. 나 자신도 돌아보게 된다. 예민/소심/스트레스/불안/약간의 강박적 성격이 알코올의 보호막 안으로 계속 숨게 만드는 걸까…’별을 마시는 기분이다’-지난주에도 내내 별을 마셨는데 과연 끊을 수 있을까. 헌데 냅의 글은 도리어 별을 불러일으켜,5.0
인문학,9788992877442.0,읽으면 문득 문득 섬뜩섬뜩. 술이 아니더라도 무언가에 중독된 아니 중독될 수 밖에 없는 여성들에게 일독을.,5.0
인문학,9788992877442.0,"애주가에서 알콜중독자 사이, 어딘가 위치한 당신이 읽으면 좋을 이야기. 생각할 게 많아진다",4.0
인문학,9788992877442.0,알콜중독자의 이야기인줄 알았는데 존재의 ｀불안｀에 대한 이야기였다.,4.0
인문학,9788992877442.0,"드루킹 따위는 가라, 드링킹이면 무조건 만족할 수 있으니! ^^;;",5.0
인문학,9788992877442.0,올리버 색스 선생이 알코올중독에 대해서도 쓰셨던가? 아마도 이렇게 썼을 것 같다.,5.0
인문학,9788992877442.0,"˝아직까진 괜찮아. 이 정도는 괜찮아.˝ 라고 말하는 내가 생각나면 이 역시 중독인건가?적당한게 좋은 건지, 아예 이별을 해야 하는 건지 모르겠다.하긴 적당히..가 제일 어렵지.",5.0
인문학,9788992877442.0,중독은 알코올 뿐 아니라 삶 어느 곳에나 존재 한다중독의 과정은 같다,4.0
인문학,9788992877442.0,나도 용기를 줘,5.0
인문학,9788993510270.0,리뷰없음,0.0
인문학,9788993784787.0,나에겐 올해의 책,5.0
인문학,9788994054278.0,쪼꼬야~ 네 덕분에 난 다른 인간이 됐구나.,5.0
인문학,9788994054278.0,실천 없는 사유는 공허하다는 역자의 말이 가슴을 콕 찌른다. 점심엔 샐러드를 먹어도 저녁엔 족발에 소주 한잔이 생각나는 사람이라서. 이젠 부끄러움을 다 알아버렸으니 어쩐다...,5.0
인문학,9788994054278.0,우리는 차별에 대해 제대로 생각하고 실천해야 한다. 그리고 여태까지 생각하려는 시도조차 하지 않은 종차별주의에 대해 생각하고 종차별에 대항하려 노력해야 한다.,5.0
인문학,9788994054278.0,늦게나마 이 책을 알게 되어 참 다행이라 생각합니다. 많은 생각을 하게 되었어요.,5.0
인문학,9788994054278.0,정말 좋은 책이에요. 많은 사람들이 읽고 동물의 권리에 대해 다시 생각하게 되는 계기를 마련할 수 있기를 바랍니다.,5.0
인문학,9788994054278.0,생각했던 것보다 논리적인 책(정의란 무엇인가 에 버금가는)이라 놀랐다. 많은 사람들이 봐야 할 책인데 많은 사람들이 보기 싫어하는 책인것 같아 안타깝다.,3.0
인문학,9788994054278.0,‘쾌고감수능력’ 같은 이론만 암기하지 말고 끝가지 읽고 숙고해보야 진정으로 의미 있는 책일 것이다. 쾌고감수능력의 이론적 내용이야 1장으로 끝이다.,5.0
인문학,9788994054278.0,"현대철학에서 동물에 대한 도덕적 주장을 제기한 최초의 책이며 비록 출간된지 오래되었으나 여전히 반드시 읽어야할 책이다. 싱어는 공리주의를 기반으로 도덕적인 방식으로 동물을 고려하는 입문서를 써냈으며, 명료하고 설득력있게 육식, 동물실험 윤리에 대해 다루고 있다.",5.0
인문학,9788994054278.0,인생 책! 진정한 평등이 무엇인지 제대로 생각해보게 만든 책,5.0
인문학,9788994752792.0,서로 알지 못하는 사람들 속에서 개인의 정체성을 유지하는일...인간의 기본적인 욕구와 욕망사이에서 품위를 유지하는일...수용된 사람들이 지커내야하는 것들이다. 그리고 인간은 결국 자신이 하는 일이 생산적이고 의미 있는 일이라고 여겨질때 그 일을 통해서 영위되는 삶을 견딜 수 있다고 한다.,5.0
인문학,9788994752792.0,"책은 삼독이라고. 처음에는 가볍게 시작된 이야기들이, 점점 인간의 심연에 대한 깊이 있는 통찰을 요구하며, 가볍게 읽을 수 있는 책이 아니었다. 오랜만에 영혼을 울리는 멋진 책이었고, 손끝에 들고 몇번을 더 읽게 만들었다. 억압된 현실적 문제를 현명하게 처리해 가는 과정이 정치라니! 신앙!",5.0
인문학,9788994752792.0,"반드시 읽어야 할 책, 별10개도 모자랄 정도로 탁월한 책, 꼭 보셔야 합니다.",5.0
인문학,9788994752792.0,이야기의 힘!,5.0
인문학,9788994752792.0,수용소에 있는 동안 계속해서 일기를 썼다는 점이 인상깊었습니다. 개인의 생존기로서 뿐 아니라 역사의 기록으로 오랫동안 읽혀져야 할 책입니다. 김기현 목사가 올해의 책으로 꼽았던데 저도 참 좋았습니다.,5.0
인문학,9788994752792.0,밑줄 긋기 포기. 구구절절 깨닫게 된다.,5.0
인문학,9788994752792.0,인간의 내면에 대해 진지하게 고민하게 하는 책,5.0
인문학,9788994752792.0,"저자의 생동감있는 글에 어떻게 더 가까이 다가갈 수 있는가가 이책 읽기의 필수요소인것 같다. 사람의 속성에 대한 발견은 책 말미로 갈 수록 그 내용을 기억하고 싶어 접어두는 페이지가 늘어나게 됐다.사람에 대해 알고 싶고, 질문하고 있는 이에게 이책은 필수 책일 것이다.",5.0
인문학,9788994752792.0,수용소의삶을통해오늘날우리사회를볼수있는기회를열어주는책!!,5.0
인문학,9788995616796.0,제대로 된 카발라책,5.0
인문학,9788995616796.0,입문서라고 해서 샀는데 생각보다 어렵네요ㅠ 기초지식이 없으면 읽기 힘듭니다,4.0
인문학,9788995616796.0,카발라 첫입문책인데 아직 용어가 익숙치않아 어렵다. 그래도 정리된 카테고리를 보면 굉장히 깔끔히 되어있어 몇 번 카발라에 대해 읽어본 사람은 쉽게 읽을 수 있지 않을까싶다.,3.0
인문학,9788995616796.0,"배송 킹왕짱 빨랐음.
카발라의, 카발라에, 카발라를 위한 사람이라면 진리의
도서 그 자체.",5.0
인문학,9788995688984.0,읽기 편하고 내용도 짧은 편인데 이상하게 어렵다. 한 번 더 읽어야 할지 다른 책을 더 봐야 할지 고민해야 할듯.,4.0
인문학,9788995688984.0,나의그림자.항상억누르고없는것처럼치부해버리고싶었던부분을껴앉으라고말한다..좋,4.0
인문학,9788995688984.0,별로...,1.0
인문학,9788995688984.0,빠르고 정확한 배송...중고가격이 적정합니다,5.0
인문학,9788995688984.0,"저자의 지성이 느껴지는, 내용이 좋은 책이다. 그런데 너무 책이 얇다보니 좀 많이 압축된 느낌이라 좀 아쉽다. 번역 어휘중에 좀 어색한 부분도 있었고 , 입문서 개념으로는 좋을것같음",3.0
인문학,9788995688984.0,흥미있긴 한데...,4.0
인문학,9788995688984.0,내 그림자가 뭔지 알아야지 전일성으로 나아가든지 말든지 할텐데. 그걸 갈쳐달라고요.. 그림자 개념에 대한 설명이 아쉬운 책. 음.. 융을 읽어봐야겠군..,3.0
인문학,9788995688984.0,융에 대한 이해가 필요하시다면 추천하는책. 단 쉽지는 않으니 개론서를 읽고 보세요,4.0
인문학,9788995688984.0,책이 얇고 읽기에 입문자에게 큰 어려움이 없습니다.  이 책으로는 부족한 느낌. 차라리 융의 책을 읽는 것이 더 도움이 될 것입니다.,5.0
인문학,9788995688984.0,신경정신과 치료 받는 사람으로 한번은 읽어보면 좋은 책 인것 같습니다.,4.0
인문학,9788995688984.0,융의 훌륭한 저작들을 로버트 존슨이 비틀어  다시 쓴 글같아요.  신. 종교. 특히 천주교에 대한 선전이 너무 강한 글입니다.  온전하게 칼융을 이해하는데 방해됩니다.,1.0
인문학,9788995688984.0,분석심리학의 시각에서 바라보는 치유의 길. 좋음,5.0
인문학,9788995688984.0,세상은 균형!,3.0
인문학,9788995688984.0,"압축되어서 그런지 이해가 안 되는 부분도 많지만, 내 안의 그림자를 감싸안아야 되겠다는 영감을 주기엔 충분한 것 같다. 나에게는 이 책이 시작이 되었다.",5.0
인문학,9788995688984.0,역설과 그림자. 일어나는 모든 일들을 이해하게 만들어주는 역설은 훈련이 필요하지만 바로 받아들일 수 있다. 하지만 그림자는 어렵다. 다른이들의 피드백에 귀를 열어 잘 만나고 싶다. 인간은 감정의 동물이지만 본질은 영적 지혜로 자유로울 수 있는 존재라는걸 믿게된 단한번의 2015 가을이다.,5.0
인문학,9788995688984.0,융의 종교심리학을 읽고나면 더 이해하기 쉬운 책,5.0
인문학,9788995688991.0,"2021-8수줍게 실토하자면,인생책 탑5안에드는 책이다.생각의 매경계 경계마다 그사람의 간절함,절박한 생의 의지가 메아리치고있었다.생각은 실패를 두려워하지 않는다.생각은 인간들을 진정성으로 물들게했다.생각은 그사람만의 아이덴티티이다.추상적이지않고 구체적인 생각들이 결국 답을 제시했다!",5.0
인문학,9788995688991.0,진짜 번역한 박종성이란 사람 드럽게 번역 못하네. 앞뒤 문맥도 안 맞고 아. 진짜 읽는 내내 원서 가지고 차라리 구글 번역기 돌려서 이해 하는게 낫다 싶은 생각이..,2.0
인문학,9788995688991.0,"원저인 영어판을 심각할 정도로 잘라냈다. 절반 정도로 줄이지 않았나 싶다.한국어 번역본에는 그에 대해 아무런 언급도 하지 않았다.저자의 의도를 훼손했고, 구입을 한 한국어판 독자의 지식접근권을 침해했다. 아주 비양심적이다.",1.0
인문학,9788995688991.0,여러각도에서 많이 생각하고 생각의 폭도 넓혀라란 말을 아주 길게 늘여 놓은 책..,1.0
인문학,9788995688991.0,창조적인 전인이 되려면! 일과 취미를 조화시키려면!,5.0
인문학,9788995688991.0,전형적인 우월주의에 빠진 작가들.......다 아는 이야기를 주절 거리다 끝난다. 그리고 두서없는 편집도 썩 마음에 들지 않지만.....그래도 이런류를 좋아하는 사람이라면 한 번쯤 읽어 볼 만하다.,3.0
인문학,9788995688991.0,창의력이 필요하다면 가볍게 볼만 합니다.,4.0
인문학,9788995688991.0,안타깝게도 별로 새롭지 않다. 고대로부터 내려오는 invention의 방식을 답습한 서적. 만약 학생들을 교육하고 싶다면 이용해 보는 것도 좋겠지만 제목처럼 위인들의 생각이 어떻게 탄생했는지를 보기에는 부족한 책이다. 마케팅의 승리라고 본다.,2.0
인문학,9788995688991.0,"늘 생각 햇던 것들을 체게적으로 정리해준 책,,,",5.0
인문학,9788995688991.0,현 우리들이 제일 세련된것은 아니라는거,4.0
인문학,9788995688991.0,어떠한 생각의 카테고라를 갖고 접근 하느냐에 따라 성공의 열쇠를 가질 수 있느냐의,3.0
인문학,9788995688991.0,다들 이렇게 살고 있지 않나? 그다지 특별할 것 없는데 정리해 놓으니 있어 뵌다.,4.0
인문학,9788995688991.0,생각의 탄생이라기 보다 과학적 역사,4.0
인문학,9788995688991.0,"창의성이란 여러 학자들의 견해가 있음에도 상당히 동의가 안되고 있는 개념이다. 있다는 것은 분명한데 지능과의 상관, 어떻게 향상시킬 수 있는가, 구체적으로 어떻게 드러나는가는 어려운 문제이다. 생각의 탄생은 창의적인 사람들의 특성을 모아 분류한 책으로 창의성에 대한 하나의 답이다.",5.0
인문학,9788995688991.0,"한 장 한 장이 머릿속에 깊게 베어든다. 무슨 일을 하던, 그 일을 어떻게 하던 읽어두어서 손해 볼 일은 없겠다.",5.0
인문학,9788995688991.0,외형을 보고 손이 안갔지만... 흥미롭고 재미있게 읽었어요~,4.0
인문학,9788995688991.0,정말좋은책!구성도알차고내용도정말좋아요보는사람마다탐내서선물했답니다.,5.0
인문학,9788995688991.0,후아..거의 논문수준의 책입니다. 예술에 닿아있지 않아있지 않은 평민들에겐 비추,5.0
인문학,9788995688991.0,무엇보다독서를흥미롭게한것은부부가공동저자였다는점과둘모두가활발한활동가라는점~,4.0
인문학,9788995688991.0,아직 읽지는 않았지만 좋은 가격이라 미리구입,4.0
인문학,9788995688991.0,내가 읽은 2009년의 책중 최고의 책이다.,5.0
인문학,9788995688991.0,천재들의 사고방식을 엿볼수있는 재미난 책. 통합교육의 중요성을 느끼다!,4.0
인문학,9788995688991.0,좋은 선택이었습니다. 책의 가격이 높기는 하나 읽은 만큼의 만족은 주겠지요,3.0
인문학,9788995688991.0,아직 읽어보지는 않았지만.,5.0
인문학,9788995688991.0,책이 생각보다 크고 두꺼워서 놀랬는데 내용이 알차고 좋네요,4.0
인문학,9788995688991.0,생각 이란 단어를 마음 깊히 새길수 있는책,5.0
인문학,9788995688991.0,내용 자체가 생각치도 못한 발상이네요.창조적사고력을 길러야하는 사람은 꼭 읽길.,5.0
인문학,9788995688991.0,생각하는 방법에 대한 인식을 새롭게 할 책,5.0
인문학,9788995688991.0,생각의차이가.이렇게큰힘을발휘할수있다는것을 .다시한번더실감케 해 주는 책입니다,5.0
인문학,9788995688991.0,좋아요^^,4.0
인문학,9788995688991.0,도서관에서 빌려보고 너무좋아 소장하기 위해 구입한책. 생각을 생각하게 만드는 책.,5.0
인문학,9788995688991.0,하나하나 방법을 소개하면서 결국 ˝통합˝으로... 생각의 도구를 활용하는 인간의 통합적 능력이 역시 최고!,4.0
인문학,9788995688991.0,삼성에서 직원들에게 창조력을 기르기 위해 필독서로 권했다고 한다. 명불허전이다.,5.0
인문학,9788995688991.0,"이것도 가지고 있을 책이 못된다. 안녕.., 산만하고 파편적이고 깊이가 없다.",3.0
인문학,9788995688991.0,우리의 사고가 아니라 몇몇 뛰어난 사고를 하는 그들의 생각이 어떻게 형성되고 이루어 지는지 접근해볼수 있는 기회. 그중 패턴에 대한 이야기는 가장 흡족했다. 사고의 속도와 창의성을 배가 시키는것 같다.,4.0
인문학,9788995688991.0,고개를 끄덕이고 무릎을 치게 만드는 유익하고 재미있는 책.,4.0
인문학,9788995688991.0,생각을 낳는 도구가 무엇인지 들어보셨나요???,4.0
인문학,9788995688991.0,이 책 좋 아 함 . . . 두꺼워서 읽는데 오래걸렸는데 확실히 남는게 있음..,5.0
인문학,9788995688991.0,"생각보다 거창한 책, 들여보면 별 내용없는 책.",1.0
인문학,9788995688991.0,nlp의 교육목적 활용과 일맥상통 합니다. 강추,5.0
인문학,9788995688991.0,생각하는 방법에 대한 흥미로운 생각.,3.0
인문학,9788995688991.0,천재들만이 할수 있을것 같은 위대한생각들이 나오는 이야기,3.0
인문학,9788995688991.0,진도는 안나가지만 꼭읽어보길 권합니다. 생각과 사고의 중요성..,5.0
인문학,9788995688991.0,조금 두껍지만 아주 유익한 내용을 다룬 참신한 책이다.,5.0
인문학,9788995688991.0,다소 뻔한 느낌의 책입니다. 다 읽고도 그리 남는 내용은 없는 듯한...,3.0
인문학,9788995688991.0,밑에 분들 다들 천재이신듯... 읽기 너무 힘든책... 손에 잡았다가도 이내 놓는책...,1.0
인문학,9788995688991.0,아이를 가르치는 교사들이 읽으면 좋을 것 같은 책. 나에게도 도움이 되었다. 사물을 바라볼 때 모든 감각을 동원할 것!,5.0
인문학,9788995688991.0,"하드커버에 두껍지만, 읽다보면 빨려드는 책. 재미있어서 추천합니다.",5.0
인문학,9788995688991.0,생각을 탄생시키는 방법에 대한 이야기..,4.0
인문학,9788995688991.0,"생각이 어떻게 탄생하는지 정리 할 수 있는 책, 당신에게 도움이 될 것이다.",5.0
인문학,9788995688991.0,"창의성 개발을 위해 구입했는데 발상의 전환, 역발상적인 사고에 도움이 많이 됩니다.",5.0
인문학,9788995688991.0,가족끼리 읽으려고 했는데 잘 구입했습니다. 아이도 읽으면 매우 유익하고...,5.0
인문학,9788995688991.0,창조는 틀을 깨는데서 나온다.통섭의 시대에 우리에게 던지는 메시지.뒤집어보라,4.0
인문학,9788995688991.0,천재들의 사고법에 대해 여러가지로 분석하고 이해시켜준 책입니다.강력하게 추천드리고 누구나 반드시 읽어보라고 감히 권장드립니다.,5.0
인문학,9788995688991.0,생각은 무엇이고 생각을 하게되면 어떻게 되는지를 알수있는책,5.0
인문학,9788995688991.0,생각보다 어려운 내용. 읽고 있으면 그동안 나의 생각을 되돌아 볼수있는 좋은 경우..,3.0
인문학,9788995688991.0,"<최고의 공부>이라는 책을 읽다, 우연히 같은 시기에 읽게 됐는데, 연결되는 부분이 있어서 더 크게 와닿았습니다. 매우 만족스럽습니다. 잘 배우고, 많이 생각할 수 있었네요.",5.0
인문학,9788995688991.0,정말 탁월한 멋진 책이다! 이어령 선생님이 괜히 추천의 말을 썼겠는가.다만 너무나 안타깝고 아쉬운 마음에 번역의 문제를 지적하면서 다른 독자들과 출판 관계자 분들께 문제의식을 촉구하고 싶다. 가장 큰 문제는 원문을 최소한 20-25% 이상 누락했다는 것. 자세한 지적은 <마이 리뷰>에서 계속,4.0
인문학,9788995688991.0,생각하던 내용은 아니지만..그런대로볼만함,2.0
인문학,9788995688991.0,결국 전인교육!,5.0
인문학,9788995688991.0,사람은 생각을 할 수 있는가? 라는 생각을 정리해주었습니다,5.0
인문학,9788995688991.0,현재 짬 날때마다 열심히 읽고 있습니다.아이 양육을 위해 산건데 제가 더 도움을 받고 있습니다.,4.0
인문학,9788995688991.0,"창의적으로 생각한다는 게 어떤 것인지, 어떤 식으로 생각하려고 노력해야하는지 생각할 수 있게끔해주는 책이었습니다.",4.0
인문학,9788995823231.0,전 정말 이책이 너무 좋아요 ! 모든 선과 자유와 어린아이같은 순수함을 얻고싶다면 ! 아니 다시 일깨우고 싶다면 이 책을 . ..! 전 정말 천국을 만난것같았어요. 너무나 행복하고 행복했던 책 !! 정말 일주일동안 아나스타시아 얘기만 하고 다녔어요. 정말 행복한 책이에요 맑고 깨끗한 책! 본질.!,5.0
인문학,9788995823231.0,여기저기 권해주고 싶은 책이에요:D,5.0
인문학,9788995823231.0,"인생책입니다. 인간 본질, 그리고 나아가야 할 사랑의 공간, 가원에 대해 대해 이야기해주고 지금 인류가 겪는 곤란과 통제에 대해 설명해주어 코로나 시대에 큰 도움이 되고 있어요. 전권사서 2번씩 읽었어요. 또 읽을예정이고요^^",5.0
인문학,9788995823231.0,자연과 인간이 가진 본질에 대해 생각하게 해주는 책,5.0
인문학,9788995823231.0,"구하기 힘들었는데, 이제야 구했네요. 아직 읽지 못했지만 세평과 부합되기를 ..",1.0
인문학,9788996056164.0,공부해서 남 퍼주는 사람중 가장 가까이 있는 분.,5.0
인문학,9788996056164.0,가오에서  고귀함으로 가는 길을 안내해 주는 책. 책을 읽고 마음에 간절함이 생겼다.,5.0
인문학,9788996056164.0,강유원의 어떤 책이든 좋습니다.그냥 아무 페이지나 펼쳐서 쭉 훑어보세요.그 밀도가 처음부터 끝까지 갑니다.,5.0
인문학,9788996056164.0,"저자가 독자들에게 제공해주는 지식이나 통찰, 강의녹음, 도서목록, 구체적인 글쓰기와 공부의 방법까지 꼼꼼하게 챙기다보면, 어느새 그가 나 자신에게 정신적인 고양의 계기를 마련해주었음을 깨닫게 된다. 그러고 나면 먹고사는 일과 무관한 공부도 평생 지속할 수 있겠다 하는 뱃심이 생긴다.",5.0
인문학,9788996056164.0,요새는 책을 이렇게 만드는게 유행인가? 여백으로 채우는게...,3.0
인문학,9788996056164.0,단순 고전해설 요약집이 아니다. 일관된 흐름을 갖춘 인문고전강의의 정수이자 백미.,5.0
인문학,9788996056164.0,"<책과 세계>의 그 얇은 소책자를 읽고 엄청난 파괴력을 느꼈다. 그리고 좀 더 구체적으로 인문학에 대해서 개괄해주길 원했고 그 결실이 바로 이 책이다. 한 마디로 정리해서 이 책을 왜 읽어야 하냐면 ˝인문학이 도대체 무엇이고, 그 효용은 무엇인가˝라는 의문을 가진 사람들이라면 꼭 추천한다.",5.0
인문학,9788996056164.0,강유원 선생님의 강의 녹음 파일을 들으면서 같이 보면 이해에 도움이 많이 됩니다.,5.0
인문학,9788996056164.0,89~90면까지 이어지는 과제 방법에 대한 그의 설명만 읽어봐도 안다. 공부를 어떻게 해야 하는지 말이다. 그는 공부의 방법을 안다.,5.0
인문학,9788996056164.0,눈에 들어오는 족족 모두 흡수해서 머리에 하나하나 새겨넣고 싶은 소중한 책.,5.0
인문학,9788996056164.0,고전섭렵의 자신감을 불어넣어준 책. 추천합니다,5.0
인문학,9788996056164.0,모든 학생에게 권합니다.,5.0
인문학,9788996056164.0,강유원 선생님은 최고의 선생(고전)을 만날수 있도록 이끄시는 안내자이며 나침반!,5.0
인문학,9788996056164.0,스승을 만나게 해주어서 고맙습니다.,5.0
인문학,9788996056164.0,훔치고 싶은 저자의 식견! 더 이상 말이 필요없음...,5.0
인문학,9788996056164.0,음성강의로 놓칠수 있는 정확한 텍스트 구성이 맘에 든다. 참고도서까지 다 읽다 보면 볼 책이 넘쳐난다는게 함정카드.추천!!,5.0
