구분,ISBN13,review_content,rating
인문학,9791169092210.0,최근 이렇게까지 한 책으로 인해 다른 책까지 가지를 뻣어나가 읽고 싶다는 욕망을 자극하는 책을 본 적이 없다. 이 책은 서문만으로도 읽을 가치가 충분하다고 생각한다. 독자를 충격하지 못하면 인쇄와 동시에 죽은 책이라는 말에 전혀 해당되지 않는 책. 파묻혀있던 책도 소생시키는 책이다.,5.0
인문학,9791169092210.0,이렇게 내 영혼의 울림을 주는 역사 에세이는 처음 보았다항상 좋은것만 추구하는게 아니라 무엇을 남기느냐가 얼마나 큰 축복인지 깨닫게 해주는 책이다,5.0
인문학,9791169092210.0,"금서들의 푹신한 커버 같은 책. ˝안전한 책들의 칵테일파티˝를 지적하는 이 책의 기획과 해석은 또 매우 안전한 편이라 ˝나쁜 책들의 칵테일파티˝ 같다는 인상을 감추기 어렵다. 기획기사를 역은 책이라 금서들의 유기성이 아쉽고, 해외문학상을 곧장 문학적 성취로 환원하는 말하기는 갸웃하다.",2.0
인문학,9791169092210.0,금서는 옛말이라고만 생각했는데 .. 여전히 지정되고 있다는 걸 눈으로 확인하니 더더욱 나쁜책을 읽어야겠다는 생각이 든다. 권력이 책을 읽지 못하게 한다고 생각까지 가로막을 수 있는 건 아니니까.,5.0
인문학,9791169092210.0,"시대의 감추고 싶은 암울한 사건, 사상, 인간의 모습을  금서라는 두 단어로 낙인 찍어왔다.나쁜 책 이라는  반어적 표현에 궁금하여 티저북을 만났다.  김유태  작가분이 선택한 30권의  나쁜책으로  새로운 세상으로  떠나볼 수 있다.",5.0
인문학,9791169092210.0,현재까지 올해의 책.,5.0
인문학,9791169092210.0,좋은 책이다. 여기에 있는 책들을 한 번씩 다 읽어보고 싶어졌다.,5.0
인문학,9791169092210.0,잘 읽겠습니다,5.0
인문학,9791169092210.0,"세계 각국의 금서로 분류되었던 책에 관한 소개물. 그 이상 그 이하도 아님. 포도주의 가격을 알고 마실 때와 모르고 마실 때 그 맛에 대한 평가가 달라지 듯, 금서라는 걸 모르고 읽었을 때도 그 책이 좋은 책이라는 평가를 내릴 수 있을까?",3.0
인문학,9791169092210.0,"풍기는 분위기와는 달리, 인풋이 섹시한 데 비해 아웃풋이 매우 건전함. 금서 30권 소개 고마움. 거론된 책을 제법 갖춘 내 책장도 고맙고.",4.0
인문학,9791169092210.0,목차중 읽은 것은 유명한 책들 7권뿐 그래서 다 읽고자 검색했으나 많은 책들이 절판이라 아쉽순서데로 진행하다 구매해 읽다 접을수 밖에 없을정도로 잔인했던 아메리카 사이코.. 다른책도 이정도는 아니겠죠ㅜ 포트노이의 불평이 있어서 놀랬.. 작가때문에 읽었는데 실망한 책이였는데 재독해야하나,4.0
인문학,9791169092876.0,"강연집 이라서 그런지 이전 저작들 보다 쉽게 읽힙니다. 쉽다고 내용이 가벼운 건 아닙니다.1강에서 다룬 박문호, 유시민, 정희진 작가에 대한 동뜬 비평은 탁월하게 느껴지고,7강에서 이야기하는 TKS라는 한국 기득권 정치지형과 실체를 아주 세밀하게 해석한 게 이채롭습니다.",5.0
인문학,9791169092883.0,"작문 뿐만이 아니라 전반적인 창작 분야에 도움이 될만한 내용.새롭지는 않지만 알고는 있어도 실천하기 어렵거나 까먹었을 부분들을, 작가의 경험과 함께 되짚어준다.길을 잃고 방황할 때 이 책을 종종 꺼내 읽게 될 것 같다.",5.0
인문학,9791169092883.0,서문부터 밑줄긋기를 빼곡히 한 책은 이 책이 유일할것같다. 마지막 장까지 공감되지않는 부분은 단 하나도 없어 읽는 내내 많이 위로됐다,5.0
인문학,9791169811750.0,"˝장애인의 요구까지 들어주면 나라 망한다˝라고 말하는 기획재정부 장관의 ‘사람의 말이 아닌 말‘이 나오는 이 나라에서, ‘있음‘의 가장 쓰라린 형식일 수 있는 ‘비어 있음‘을 ‘아무것도 없음‘으로 치부하는 세상에서 마오리족 전사들의 춤 하카를 함께 추는 冊. ˝바라는 것은 그가 나에게 안심하고 자기의 슬픔을 맡겨주는 것이고, 나는 되도록 그의 떨림과 두려움을 ‘예쁘게‘ 기록해주고 싶다.˝ 두 번째 사람 홍은전의 말. 한 해의 끝에서 이 책을 읽어 감사하다.",5.0
인문학,9791169811750.0,"나는 왜 보지 못했을까, 보고도 못 본 척했던 것이겠지... 무엇을 보고 어떻게 말할 것인가를 묻는 책. 글 쓰는 사람의 윤리, 함께 살아가는 사람들의 고통과 절망에서 눈을 돌리지 않는 동료 시민으로서의 책무를 생각하게 된다.",5.0
인문학,9791169811750.0,"앰프가 되지는 못하니 소박한 수신기라도 되어 듣고 읽습니다. 호기심보다는 염려하는 마음에서 공부하고 쓴 글, 매 꼭지가 다 고맙습니다.",5.0
인문학,9791169811750.0,"하나하나 짧은데 어쩐지 아껴서 읽게 된다, 분명 쉬운데 그냥 후루룩 넘길 수가 없다, 나는 정말 아무것도 몰랐구나, 부끄러워지기도... . 고마운 책!",5.0
인문학,9791169811750.0,"2024년의 절반을 넘기고 있는 지금, 여전히 내겐 ‘2024년 올해의 책‘.",5.0
인문학,9791169812245.0,사회과학 및 자연과학 버전이 가미된 동양 고전 해설서라고 해도 좋을 것 같다. 이 책의 진가는 옛날 고전을 가져와 현재 우리의 생각의 틀과 편견을 깨뜨려준다는데 있다.,5.0
인문학,9791169812245.0,재밌게 읽었네요,5.0
인문학,9791169850445.0,너무 어려운건지...아니면 너무 먼산얘기만하는건지..읽어도읽어도...눈이 안갔었습니다. 초반까지에서 현시대의 사고와 동떨어지는 내용도 다소 있다보니...이게 몬가 했어요. 며칠 덮어두고 안읽다가 다시 읽었습니다. 중반이후부터 좀 읽혔던것같네요.,4.0
인문학,9791169850445.0,이해하는데 좀 어려웠내여,3.0
인문학,9791169850445.0,"제목이 좋아서 샀는데, 몇 페이지 읽어 보니 번역도 잘 되어 있고, 쇼펜하우에르 책 멋집니다.",5.0
인문학,9791169850445.0,글자체는 말을 어렵게하고 서두도 길어 쭉쭉읽히지 않지만 내용은 좋네용 요즘시대를 감안해서 거를건 거르고 마음에 넣을건 넣어두면 좋은 글인것 같습니다.그래도 산김에 좋은글인것같아 끝까지 읽어보려고요..ㅎㅎ,4.0
인문학,9791169850445.0,제목과 내용 줄거리 잠깐 읽어 보고 괜찮아 보여서 구매하고 일단 다 읽긴 했지만 한번 읽어서는 내용을 이해 하기 어려운 책이라 생각합니다. 이해 하기 어려운 내용들이 많이 적혀 있어 뜻을 이해 하지 못 하고 넘어가는 경우가 많은 책이 였다 생각 합니다.,4.0
인문학,9791169850445.0,행복은 꿈일뿐 고통은 현실이다. 뭔가 알쏭달쏭 난해하면서도 메세지들이 두고 두고 남게 만든 책.,4.0
인문학,9791169850476.0,마키아벨리 군주론도 고전이지만 책뒤편의 해설서가 정말 백미입니다. 읽으면서 그시대 긴박한 순간과 병사들의 함성소리가 들리는 듯 합니다.,5.0
인문학,9791169850476.0,"역시 김상근 교수님. 르네상스 전문가의 번역본입니다. 군주론은 읽으면 읽을수록 새롭습니다. 그리고, 교황, 피렌체, 나폴리, 밀라노, 베네치아, 프랑스, 신성로마, 스페인 역사도 같이 알고 보면 마키아벨리의 통찰력이 놀랍습니다. 한비자와 다르게, 마키아벨리의 귀족&민중을 다스리는 군주.",5.0
인문학,9791169850889.0,"인생이 고통일까?인생은  강물이다.흐르는 대로 때론 장애물도 만나지만,죽음을 향해 흘러가는 강물이다...",5.0
인문학,9791169850889.0,나에게 ‘철학‘과 ‘철학과‘의 쓸모를 인식시키고 삶이 힘들 때 심리 서적만이 아니라 철학 서적의 쓸모도 인식시켰다.  내 곁에 철학이 있게 해 주었다.,3.0
인문학,9791169850889.0,작다. 작은데 솔직히 엔케이리디온 한국 서적 중에서 제일 읽기 쉽게 번역되어 있다. 의미있는 말만 가득한 책,5.0
인문학,9791169850964.0,"검수가 있었나 의심될 정도의 오탈자가 많이 보이고,글의 읽힘마저 일반적이지 않아 읽는 내내 거슬림.p.24타인을 위해서는 최선을 하다면서도 자신을 위해서는 아무 것도 원치 않는 사람은 '이타주의자'라고 부른다.-> *최선을 다하면서도/ *아무것도/ *사람을",1.0
인문학,9791169850964.0,요새 다정함이라는 주제가 많이 나오는 것 같네요. 자기개발이라고 착각하실 수 있겠지만 인문학 성향이 짙습니다. 저는 과학책보다는 더 마음에 듭니다,5.0
인문학,9791169851015.0,최고의책임,5.0
인문학,9791169851015.0,마음에 와닿는 내용이 많아서 구매했어요,5.0
인문학,9791169851039.0,요즘 같은 시대에 필독서라 생각해요. 탐독할게요.,4.0
인문학,9791170370369.0,"유운성은 늘 다시 생각하게 하는 글을 쓴다. 곱씹으며 한 줄, 한 줄 읽게 되고 되돌아와 다시 읽다보면 놓쳤던 부분을 덜컥 발견하게 된다. 글로 표현하기까지 겪어야 했던 수많은 고민들이 문장 아래에 광맥처럼 뻗어있다. 올 해 단 한 권의 영화 비평서를 뽑는다면 단연 이 책이어야 한다.",5.0
인문학,9791170370369.0,"설명 없는 직관으로만 가득 채워진 책이다. 아니, 설명을 시도하긴 한다. 그저 다량의 개념과 이론을 마구 쏟아내면서 말이다. 그리하여 이 책은 개념과 이론들이 중구난방으로 떠들어대는 혼란 그 자체다. 당신은 보다 친절하게 글을 쓸 필요가 있다. (악플 때문에 3점에서 1점으로 점수 더 내림)",1.0
인문학,9791170370369.0,잊고 있던 질문들을 다시 끄집어내어...,5.0
인문학,9791170400523.0,"이어령 선생님을 존경합니다. 축소지향의 일본인은 제 가장 애독서죠. 그래서 신간이 반갑기는 한데, 요즘은 뭔가 컨텐츠를 쥐어짠다는 느낌이 자꾸드네요. 선생님이 만든다기 보다는 주위에서 선생님을 쥐어짠다는 느낌. 제 표현이 저속하다면 죄송합니다만, 떠나기전에 다 내놓고가라는",3.0
인문학,9791170400523.0,"분명 좋은 내용이 있기는 한데, 책 내내 김지수 작가가 이어령 선생님을 거의 신격화하는 듯한 스탠스를 취하고 있어 편하게 보기에 거부감이 드는 책. 외려 이 때문인지 이어령 선생님의 말씀이 꼭 신천지 대교주의 말과 다를 바 없어보임. 제 주관적인 생각입니다.",3.0
인문학,9791170400523.0,이 책을 사서 읽을 때만 해도 이어령선생님이 이렇게나 빨리 머나먼 길로 가실 줄은 몰랐다...책을 통한 정말 마지막 수업이  되어버렸다....다시 한번 삼가 고인의 명복을 빕니다...이 시대의 지성....,5.0
인문학,9791170400523.0,읽어갈수록 선생님이 그리워집니다. 편히 계시다 가시지 또 이렇게 남겨지는 이들을 위해 끝까지 삶으로 보여주시는 모습에 깊이 감사드립니다. 생각하며 살게 하시려는 질문들 앞에서 선생님의 말씀 앞에서 고개 숙이고 오래 잊지 않겠습니다. 두고 두고  읽으며 되새기겠습니다.,5.0
인문학,9791170400523.0,이어령 선생의 통찰력 넘치는 생각들을 접할 수 있다는 건 얼마나 행운인가. 하지만 이어령 씨를 현자화하는 대담자의 태도는 어쩐지 불편하다. 과하다.,4.0
인문학,9791170400523.0,현대사의 지성의 거인으로 기억될 이어령 선생님의 생전 마지막이 된 진솔한 이야기는 뭉클하고도 잔잔한 반향이 일어납니다. 항암치료를 거부하면서 죽음을 들여다보려 했던 용기와 생명의 원천인 어머니의 품으로 돌아간다는 말씀에서 어떻게 죽음을 맞이할지 새롭게 새겨봅니다.,5.0
인문학,9791170400523.0,"읽는 내내 감탄밖에 안나온 책.  아직도 이 시대의 대표 지성인의 자리를 굳건히 지키고 계시는 분.럭셔리한 삶은 스토리텔링을 많이 가지고 있는 사람이라는 말이 어떻게 인생을 살아야하는지 다시한번 생각해주는 책! 늘 책에서만 만났던 나의 인생 선생님, 나중에 천국에서 만나요. 감사합니다",5.0
인문학,9791170400523.0,"선생님 마지막 수업이 아니기를 바랍니다. ㅠ책 오늘오후에 오는데 너무기대됩니다. 제가 어둠속에있을 때 김지수 작가님 통해서 선생님야기 처음 접했는데, 작가님도 선생님도 너무 감사합니다. 다시 살아가는  힘이 되었습니다.",5.0
인문학,9791170400523.0,모임선정책으로 읽어보았습니다2021년마무리와 2022년시작을 함께 할 수 있는 의미있는 책으로죽음과 삶에 대해 돌아보고현재를 충실히 살아가도록 하는 책이에요,5.0
인문학,9791170400523.0,이어령 선생님의 말씀은 좋았으나 김지수 작가가 너무 선생님을 우상화 하고 있어 읽는 내내 거북했습니다. 기독교인이라면 피해야하는 것이 우상화인데 영성 이야기를 하면서 작가가 적극적으로 우상화 하고 있어 아이러니 합니다.,3.0
인문학,9791170400523.0,Tuesdays with Morrie와 같은 감동을 기대했는데 책 사고 후회해 보기도 처음이다. 감동은 화려한 미사여구로 억지로 만드는 게 아니라 가장 평범한 말로도 자발적으로 나오는 그런 것이 아닌가 싶다.,1.0
인문학,9791170400523.0,감동적이다. 김지수 기자님이 정리해준 이어령 선생님의 인터뷰집 모두가 읽어봐야한다,5.0
인문학,9791170400523.0,˝죽음이 무언인지 알게되면 삶이 무엇인지 알게된다˝라는 선생님의 말씀처럼 죽음의 두려움은 가벼워지고 지금이순간 집중할 수 있는 귀중한 지혜를 선물로받은건 같습니다.감사합니다.,5.0
인문학,9791170400523.0,천천히 곱씹으며 읽어갑니다.깊이와 여운 감사합니다,5.0
인문학,9791170400523.0,죽음의 목전에서 그와 같이 빛나는 삶을 살아내고 계셔서 나에게 눈물 한 방울. 좋은 책 감사합니다.,5.0
인문학,9791170400523.0,암 투병중에 죽음을 직감하고 있는 저자와의 대담 형식으로 이루어진 이 책은...인생에 대한 애잔함과 절박감 그리고 죽음에 대한 의문을 담담히 풀어내고 있다. 동물원 철장에 갇힌 호랑이는 겁이 안나지만 그 호랑이가 철장을 부수고 내 앞으로 달려오고 있다면 사정이 다르다는 표현에 공감 한다.,5.0
인문학,9791170400523.0,이 책을 읽고 나에게도 훌륭하고 존경하는 스승님이 생겼다는 사실에 감사하다.,5.0
인문학,9791170400523.0,"종교를 믿지 않음에도 불구하고 술술 읽히는 그의 사상, 그의 세계. 젊은 사람들은 사색하고 고뇌할 필요가 있다. 같은 뇌 모양에 같은 뇌 주름 갯수를 가지고 같은 생각을 하고 같은 말을 내뱉어야만 미움받지 않는 인간이 되겠지. 나는 외로웠다, 나는 혼자였고 별종이었다. 그런 마음을 위로하는 책",4.0
인문학,9791170400523.0,"이 식대의 마지막 스승, 말년에는 영성까지 겸비한 이어령 교수의 마지막 인터뷰모음집을 보며 참 많은 생각을 하게 만드네요. 그가 노년에 이야기했던 대로 시오노 나나미의 로마인이야기를 뛰어넘는 ‘한국인 이야기‘의 완간을 못 본것이 너무 아쉬울 뿐입니다.",5.0
인문학,9791170400523.0,생각보다 큰 울림이 있는 책! 인터뷰어도 넘 잘 쓰심,5.0
인문학,9791170400523.0,선생님의 담담한 말투가 듣는 사람을 더 감동을 주는거 깉아요..,5.0
인문학,9791170400523.0,"한 장도 허투루 넘길 수 없었습니다. 수일 동안 천천히 책장을 넘기며 죽음을, 삶을, 진리와 희망을 그리고 무엇보다 나라는 존재를 비추어 생각했습니다.",5.0
인문학,9791170400523.0,시대의 어른이자 스승의 말씀 하나 하나에 울고 웃게 만드는 놀라운 책. 이제는 ‘돌아가신‘ 이어령 작가님께 늦었지만 고개숙여 ‘감사합니다‘라고 인사드리고 싶다. 스승의 언어를 잘 정리해낸 김지수 작가에게도 따듯한 박수를 보낸다. 두고 두고 읽게 될 책이다,5.0
인문학,9791170400523.0,이 글에는 스포일러가 포함되어 있습니다. 보시겠습니까?회색 영역을 클릭하면 내용을 확인할 수 있습니다.,5.0
인문학,9791170400523.0,신비가 머리에 꽂혀요 놀라운 책,5.0
인문학,9791170400523.0,죽음이 있기에 삶이 더 의미 있다는 것을 다시 한 번 되새기게 됩니다. 작가님의 프롤로그만 읽어도 가슴이 뭉클해지고마지막 수업을 함께 하신 감동이 그대로 전해집니다.,5.0
인문학,9791170400523.0,어렵게 읽지 않아도 감동이 되는 책... 너무 좋다. 곱씹어 보고싶다,5.0
인문학,9791170400523.0,"객관적이지 못하고, 중의적인 단어의 선택들이 나열된 이 책이 밉지는 않았다. 지성인이 먼 과거에 두고온 기억과 지혜를 잠깐 맛보게 된 듯 하다. 기독교 서적으로 볼게 아니고, 죽음을 앞둔 사람의 영적 직관을 글자에 담아두었다고 생각한다.",4.0
인문학,9791170401643.0,리뷰없음,0.0
인문학,9791170522393.0,데이비드 홉킨스 박사를 포함한 지금  우리 시대에 등불이 되어주는 여러 성인들에게 우선 감사를 표한다.이 명상에세이는 핵심 엑기스만 뽑아놓은 정말 엄청난 에너지의 도서이다.책을 오늘 받은후 1월부분만 읽었는데도 의식이 확장됨을 느낀다. 정말 감사합니다.,5.0
인문학,9791170523932.0,리뷰없음,0.0
인문학,9791170525325.0,리뷰없음,0.0
인문학,9791170525349.0,리뷰없음,0.0
인문학,9791170831211.0,빼어나고 따스하고 명쾌하다. 찬란하고 장엄한 책이다. 김기석목사님 이런 책을 써주셔서 감사합니다,5.0
인문학,9791170831211.0,"신화,역사,철학,문학 등 인문학적 사유로 하나님과 성경 속 인물, 그리고 나 자신을 만날 수 있다. 틀에박힌 인식을 깨고, 타자와의 관계 안에서 나를 재정의하며, 모호한 게 틀린 게 아님을 깨닫게 된다.",5.0
인문학,9791170831747.0,리뷰없음,0.0
인문학,9791170831754.0,리뷰없음,0.0
인문학,9791170831761.0,리뷰없음,0.0
인문학,9791170871514.0,길가메시 서사시 같은 메소포타미아의 이야기와는 또 다른 이집트만의 매력이 있네요. 거기다 고대 이집트가 생소할 독자들의 이해롤 도와줄 풍부한 부록까지. :),5.0
인문학,9791170871514.0,이런 책이 출간되다니 너무 감사합니다^^,5.0
인문학,9791170871514.0,"주원준 교수님의 <길가메쉬>가 고대 메소포타미아 문학의 진수로 우릴 인도한다면, 유성환 교수님의 <최초의 소설 시누헤 이야기>는 고대 이집트 문학의 여명으로 우릴 인도합니다.",5.0
인문학,9791170871514.0,"책 옆부분이 좀 찍혀서 왔지만 교환 번거로워서 그냥 보렵니다. 풍요로운 이집트, 이집트가 한창 번성했던 때를 이 소설을 통해 볼 수 있다는 기대가 있네요 :-)",4.0
인문학,9791170871514.0,최초의 소설이라는 소개를 보고 북펀딩해보았습니다! 이집트는 정말 최초가 많은거 같아요 게다가 이집트 전문가인 교수님께서 소개해주신다고 하니 더욱더 기대가 됩니다!! 재밌게 잘 읽도록 하겠습니다 앞으로도 알라딘 북펀딩에서 좋은책들 많이 소개해 주세요! 감사합니다!!,5.0
인문학,9791170871514.0,북디자인이 너무 멋져서 넋놓고 보게 됩니다. 아무리 보아도 질리지 않는  책표지도 훌륭하고 유성환 번역가님의 집념과 열정 덕분에 시누헤 이야기를 읽을 수 있어 행복합니다.,5.0
인문학,9791170871514.0,기대한 것 보다 훨씬 재미있습니다 강력추천!,5.0
인문학,9791170871514.0,오래된 시간에 역사의 흔적과 문명의 기록이라고 할수있는 시누헤이야기 난 다시금 이집트에 신비로움과 경이로움 빠져들게 된다,5.0
인문학,9791170871514.0,"책 디자인도 깔끔하고, 내용은 정말 알차네요! 고대 이집트 문자에 더욱 관심이 생깁니다 :)",5.0
인문학,9791170871514.0,아주 오래된 소설이지만 원초적인 재미를 느낄 수 있을지 기대됩니다,5.0
인문학,9791170871514.0,출간되길 기다렸는데 드디어 받았습니다. 엄청 기대중이에요.,5.0
인문학,9791170871514.0,이집트 문명은 파파잼,4.0
인문학,9791170871514.0,인류 최초의 이야기! 시누헤 이야기!! 잘 받아 잘 읽었습니다!!!,5.0
인문학,9791170871514.0,오늘 책 도착! 넘 기대되어요 ❤️ 책도 넘 이쁘다 :-),5.0
인문학,9791170871514.0,오늘 손에 들어오네요. 재미있을 꺼 같아요,5.0
인문학,9791170871514.0,기록으로 남은 첫 허구. 옛 문명이 만들어낸 ‘이야기‘.,5.0
인문학,9791170871514.0,이집트 문명에 관심이 생겨서 구입했습니다 소설 재미있을 거 같아요 두근두근,5.0
인문학,9791170871514.0,"만듦새가 좋은책임. 단단하고 시각적으로도 예쁘고, 이런책 받으면 펀딩하길 잘했다 싶음. 저자가 욕심이 많다. 원문 상형문자도 보여주고싶도, 직역도 해주고 싶고, 해설도 해서 이해도 시켜주고싶어 한다. 받이 받아먹겠습니다~",5.0
인문학,9791170871514.0,좋은 책 감사합니다. 잘 읽겠습니다!,4.0
인문학,9791170871514.0,이집트에 관심이 많은 사람으로서 책이 도착하기만 기다리고 있습니다 빨리 읽어보고 싶어요,5.0
인문학,9791170871514.0,"국내 최고의 이집트학자이신 유성환 박사님의 국내 최초 고대이집트어 원전 완역 출간 진심으로 축하드립니다. 박사님의 학문적 탁월함, 빼어난 필력이 담긴 시누헤이야기가 고대이집트에대한 관심과 사랑을 불러올 것이라 생각합니다.",5.0
인문학,9791170871514.0,배송만을 기다리고 있었어요주말에 읽어보려고요!,5.0
인문학,9791170871514.0,잘 모르지만 왠지 고대 소설이라는것에 마음이 끌려 책을 펼쳤지만 너무도 무식한 탓(?)에 읽어 내려가며 상황을 파악하는데 급급하여 이야기의 재미를 느낄 수 없었지만 다시 읽으면 흥미를 붙여가며 읽을 수 있을 듯하다,3.0
인문학,9791170871514.0,"풍요로운 나일강을 끼고 번성했던 고대이집트를 어렸을때부터 많이 동경해서 다른 픽션소설들도 찾아읽었고, 실제로 이집트에도 다녀왔었는데 이 소설을 통해 4000년전 이집트의 모습과 사람들의 삶, 문화들을 더 생생하게 느낄 수 있을것같아 조금 설레네요빨리 받아보고 싶네요ㅎ",5.0
인문학,9791170871514.0,고대 이집트 지역의 문학을 우리나라 말로 읽을 수 있다니!!!!!,5.0
인문학,9791170871514.0,정말 기다렸습니다! 잘 읽을게요.,5.0
인문학,9791170871514.0,좋음,5.0
인문학,9791170871514.0,고대로의 여행은 늘 두근두근하다.,5.0
인문학,9791170871514.0,책의 내용도 신선하고 밀도 있게 잘 만든 책이다,5.0
인문학,9791170871514.0,이 글에는 스포일러가 포함되어 있습니다. 보시겠습니까?회색 영역을 클릭하면 내용을 확인할 수 있습니다.,5.0
인문학,9791170871514.0,펀딩 막차를 탔습니다. ‘길가메시 서사시‘에 이어 이번에도 좋은 책을 만나게 되어 감사하고 있습니다.,5.0
인문학,9791170871514.0,좋은 책 만들어 주셔서 감사합니다,5.0
인문학,9791170871514.0,어떤 예상을 하고 읽어도 빗나가는 신선한 독서 체험.,5.0
인문학,9791170871514.0,"요즘 매력적으로 느껴지던 분야인데, 흔하지 않은 이런 책을 읽게끔 만들어주신 출판사와 작가님께감사드립니다!!!",5.0
인문학,9791170871514.0,구입을 망설이다가 그래도 계기가 되면 좋겠다하고 신청을 했는데 주석도 많이 들어있어서 인류의 유산과 문화에 대한 호기심이 있는 제게 좋은 경험이 되겠다는 생각이 들었습니다. 제가 학생때 이집트 상형문자에 대한 책을 보던 기분이 살아나면 좋겠습니다.,5.0
인문학,9791170871514.0,책의 디자인과 만듦새가 괜찮음. 내용과 주석이 상하 절반으로 표기될 정도로 방대하기에 먼저 스토리를 읽어본 후 하나하나 해석을 대입해 보는 것을 추천함.,4.0
인문학,9791170871514.0,"기원 전, 고향을 그리워하는 망명자의 이야기가 기원 후 21세기까지 전해지게 되었습니다. 최초의 소설이자, 사후에도 읽어야하는 소설. 이 소설이 한국이라는 나라에도 번역되어 전해질 줄 알았다면, 작가는 어떤 생각을 했을까요. 망향의 감정을 따라 흘러가는 이야기들에 같이 빠져들기를 권합니다.",5.0
인문학,9791170871514.0,세계 최초의 소설은 어떤 이야기를 담은지 배울 수 있습니다.,5.0
